{
  "id": "11111111-2222-3333-4444-555555555555",
  "candidate": {
    "id": "11111111-2222-3333-4444-555555555555",
    "descriptor": "Senior Software Engineer"
  },
  "firstName": "Jordan",
  "lastName": "Reyes",
  "email": "candidate@example.com",
  "hireDate": "2026-05-03",
  "position": {
    "id": "11111111-2222-3333-4444-555555555555",
    "descriptor": "Senior Software Engineer"
  },
  "status": "Open"
}
